{
  "schemaVersion": 2,
  "contentVersion": "1.0.0",
  "id": "spring-boot-popular",
  "displayName": "Spring Boot",
  "description": "Curated Spring Boot starter recipes for the Java Command Builder. The dependency is referenced, not bundled.",
  "language": "Java",
  "category": "Popular libraries",
  "kind": "Framework",
  "canonicalName": "Spring Boot",
  "ecosystem": "Maven / Gradle",
  "targetVersion": "4.1",
  "sourceVersion": "4.1 documentation · curated 2026-08-17",
  "sourceUrl": "https://docs.spring.io/spring-boot/index.html",
  "license": "Apache-2.0",
  "isExecutionSupported": false,
  "executionSupportMessage": "Project dependency only: use a configured Spring Boot Maven or Gradle project; the isolated Java runner does not resolve external dependencies.",
  "isStarterLibrary": true,
  "createStandaloneProfile": false,
  "keywords": [
    "java",
    "popular library",
    "org.springframework.boot",
    "web",
    "dependency injection",
    "spring",
    "backend"
  ],
  "executionTarget": "External",
  "declaredEntryCount": 3,
  "declaredIndexedCount": 0,
  "declaredGuidedCount": 3,
  "declaredVerifiedCount": 0,
  "entryFiles": [
    "entries/spring-boot-popular.entries.json"
  ],
  "declaredGuideCount": 3,
  "guideFiles": [
    "guides/spring-boot-popular.guides.json"
  ],
  "legacyIds": []
}
