{
  "schemaVersion": 2,
  "contentVersion": "2.0.0",
  "id": "csharp-core",
  "displayName": "C# Core",
  "description": "C# syntax, statements, operators, declarations, pattern matching, and language-defined constructs kept separate from .NET APIs.",
  "language": "C#",
  "category": "Language core",
  "kind": "Core",
  "canonicalName": "C# Language Core",
  "ecosystem": "C# / ECMA-334",
  "targetVersion": "C# 14",
  "sourceVersion": "C# 14 language reference · 127 non-preview keyword entries",
  "sourceUrl": "https://learn.microsoft.com/dotnet/csharp/language-reference/",
  "license": "Microsoft documentation terms; Hypershell summaries are original",
  "isExecutionSupported": true,
  "executionSupportMessage": "Runs through the matching installed Hypershell terminal adapter.",
  "isStarterLibrary": true,
  "createStandaloneProfile": true,
  "keywords": [
    "c#",
    "core",
    "syntax",
    "language"
  ],
  "executionTarget": "CSharp",
  "declaredEntryCount": 142,
  "declaredIndexedCount": 127,
  "declaredGuidedCount": 0,
  "declaredVerifiedCount": 15,
  "entryFiles": [
    "entries/csharp-core.entries.json"
  ],
  "declaredGuideCount": 15,
  "guideFiles": [
    "guides/csharp-core.guides.json"
  ],
  "legacyIds": []
}
